01;Quels sont les matières devant être repassé au fer froid ?;La bonne réponse était Soie;3;Soie;Polyamide;Polyester;Coton
02;Quels sont les matières pouvant être repassé à fer moyen ?;La bonne réponse était Laine;1;Laine;Polyamide;Acétate;Soie
03;Lequel de ces produit utiliseriez-vous pour laver le sol ?;La bonne réponse était Agglutinant;1;Agglutinant;Dégraissant;Javel;Eau;
04;Pour laver les vitre, il faut :;Il faut du produit à vitre;1;Produit à vitre;menage_agglutinant;Produit à vaisselle;menage_degraissant
05;Si il y a une tâche sur un vêtement, on utilise :;On utilise un détachant adapté au tissu;1;Un détachant adapté;menage_aspirateur;Un produit à vaisselle;menage_raclette
06;Doit on boire les produits chimiques;La bonne réponse était NON;1;OUI;menage_ferdoux;NON;menage_ferchaud
07;Quel outil pour nettoyer le plafond;Pour nettoyer le plafond, il faut utiliser un balai conçu spécialement pour cela;1;Un balai spécial;menage_agglutinant;Un balai brosse;menage_degraissant
08;Il y a une areignée sur le mur, vous :;Il faut l'enlever délicatement pour ne pas tacher le mur;1;L'enlever délicatement;menage_aspirateur;Taper dessus;menage_raclette
09;Pour nettoyer des écrans il faut utiliser :;Il faut utiliser un chiffon spécial;1;Un chiffon spécial;menage_ferdoux;Un torchon;menage_ferchaud